,tweet
0,Bolsonaro faz discurso duro na ONU e ataca o Socialismo Assista na íntegra:
1,- Chanceler cubano rebate declarações de Bolsonaro: ‘Delira e tem saudade dos tempos da ditadura’
2,Esses políticos canalhas não tão nem aí pros direitos dos cidadãos, eles agem por ódio ao combate a corrupção e tão abusando da paciência do povo brasileiro.
3,ONU: socialismo e religião são destaques no discurso de Bolsonaro
4,Se a sueca esquerdopata Greta governasse o mundo o mundo viveria uma tirania ecototalitária.
5,Bolsonaro faz discurso duro na ONU e ataca o Socialismo
6,Todas as segundas e sextas tem o Podcast com o Cientista político Adriano Oliveira. Análise política, pesquisa, previsão e estratégia.
7,Opinião. A derrota da universidade
8,UMinho e Câmara de Braga querem recuperar convento com fundos comunitários
9,PGR é contra “desfiliação amigável” e vereador de VG corre risco de perder mandato. Leia Mais
10,Governador de SP afirmou que o presidente gerou péssima imagem do Brasil no exterior e que faltou humildade no pronunciamento na ONU.
11,🇧🇷🇧🇷🇧🇷 BRASIL acima de tudo, DEUS acima de tudo e de TODOS!!! discursa na . Leia a SINOPSE do DISCURSO, não paga IMPOSTO!!! Nossa política é de tolerância zero à...
12,Guerra declarada: Ex-vice que renunciou, abre baterias contra prefeita de Conde, que se defende
13,Bolsonaro ataca socialismo e diz que Amazônia não é patrimônio da humanidade: Falácia
14,- Comunicado da CDU Alcobaça A CDU Alcobaça sempre se bateu contra a gestão ruinosa do PSD.Alcobaça em relação a várias decisões, nomeadamente, sobre os muitos milhõ... (...) Continue a ler em:
15,As quatro novas substituirão quatro automóveis com cerca de dez anos de uso:
16,“Para ajudar o presidente a colocar o Brasil nos trilhos, a pressão da população tem de ser sobre o Congresso”, afirmou o senador Olimpio.
17,Escrito por: Sabrina Dayer |
18,Em tom agressivo e balístico, ataca Cuba, França e Venezuela e vê falácia sobre Amazônia
19,Eis a rica classe política falando em defesa de seus pares e investindo na lavagem cerebral do povo brasileiro.
20,Infelizmente o discurso de Bolsonaro na ONU já era previsível. O tom fez com que perdêssemos chance de avançar com as lideranças globais, que só firmaram percepção q tem do Brasil no momento. Serviu inclusive para inflamar as militância contrárias do país.
21,- O DISCURSO QUE DESVIOU O ASSUNTO
22,INVESTIGAÇÃO CPI pede à Justiça o compartilhamento de quatro delações premiadas. Documentos podem auxiliar a Comissão em investigação sobre sonegação fiscal no Estado.
23,Bolsonaro discursa na Assembleia Geral da ONU Amazônia e segurança pública foram temas citados pelo presidente. Acesse o conteúdo aberto (Foto: Divulgação - DP)
24,CPI LAVA TOGA Senador Álvaro Dias cobra investigação do Poder Judiciário. Protesto organizado pelo grupo formado por vários senadores chamado Muda Senado Muda Brasil será realizado nesta quarta, em Brasília.
25,INVESTIGAÇÃO Depoimento de Silval em CPI pode implodir Assembleia. Se falar o que sabe, Silval pode incriminar parlamentares. Caso se cale, pode comprometer termos de sua própria delação.
26,BOSLONARO ATACA A FRANÇA E DEFENDE SOBERANIA EM DISCURSO NA ONU
27,Caso Agatha. Witzel põe a culpa na maconha
28,Utransv divulga locais interditados para eventos
29,Por muito tempo vivemos em uma era de escuridão política, mas isso tem mudado! As pessoas tem percebido a influência que a política exerce sobre nossas vidas! É tempo de mudança! 🇧🇷
30,Vereadores, prefeitos, deputados, governadores, senadores, presidentes...deveriam ser trabalhos voluntários, segue mesmo sistema de votos/eleições atuais, porém, trabalho voluntário! Será que teria tanta procura e uso da frase “ajudar as pessoas” ?
31,BE acusa PS de reescrever história com factos que não são verdade
32,Frente Repúblicano Farabundista .
33,Maioria das pensões vai aumentar acima da inflação em , diz ministro do Tr
34,Menos quilómetros na campanha do BE e olhos postos nas redes sociais
35,Negociação entre EUA e China será retomada em duas semanas 🇺🇸🇨🇳 Leia Ilustração/Internet
36,O deputado Walter Cavalcante (MDB) chama atenção para a campanha de alerta sobre o câncer do aparelho digestivo e convida para audiência pública na nesta quarta-feira (25/09). Ao vivo: TV (31.1) - FM (96,7 Mhz)
37,O presidente do Jair Bolsonaro abriu na manhã desta terça feira (24), os debates da Assembleia Geral da ONU em Nova Iorque, com o intuito de rebater os questionamentos e críticas sobre sua política ambiental.
38,A política é quase tão excitante como a guerra e não menos perigosa. Na guerra a pessoa só poder ser morta uma vez, mas na política diversas vezes. - Winston Churchill. • • • • •
39,Olívia busca apoio para segunda etapa de obras na Feira de São Joaquim
40,O DEPUTADO QUE FALAVA SOZINHO via
41,Leo ao quadrado (2.10.19): Gilmar vê Moro como torturador , e dafneashton falam sobre a sessão do STF que pode definir os rumos da Lava Jato e sobre a dura…
42,Bancada Federal de MS se reúne para discutir novas regras orçamentárias e definir as emendas para
43,Para moderar nosso debate, contaremos com a presença de nossa egressa Bruna Aguera. SAVE THE DATE: DE OUTUBRO INSCRIÇÕES:
44,LÍDER DA OPOSIÇÃO DIZ QUE NÃO MUDOU DE RUMO E CONFIA NA JUSTIÇA
45,O ministro do STF Gilmar Mendes disse hoje que as prisões temporárias na Lava-jato foram um instrumento de tortura. Para Kennedy Alencar, ele está certo na colocação. Ouça o comentário.
46,Os coaches Tony Santiago e Jorgelucas trazem um debate profundo e analítico sobre os principais personagens da política brasileira, seus pensamentos e observações para uma política macroeconômica de austeridade.
47,Estudo mostra que metade dos inquiridos portugueses não confia nos líderes políticos
48,Então, o democrata esgoto antiamericano Bernie Sanders passou mal e foi pro hospital. Não sinto nem um pouco de pena desse comunista abjeto!!! Tomara que ele se encontre logo com Fidel Saddam Kadaffi Chávez e Mugabe!!!!!
49,Alunos do interior sofrem com precariedade no transporte escolar leia mais
50,Com déficit projetado em R$ ,59 bilhões, Orçamento do Governo, para , já foi protocolado na Assembleia. Saiba mais: .
51,Proposta do governo passou em primeira votação com votos:
52,Senador Marcos do Val está na UTI após problemas cardíacos
53,Desde , tratados europeus garantem que qualquer Estado-membro pode decidir unilateralmente deixar a União Europeia. elica como se dá este processo
54,Governo peruano não aceita renúncia de Mercedes Aráoz como vice-presidente
55,DIRETRIZES ORÇAMENTÁRIAS Deputados aprovam LDO em ª votação por unanimidade. Depois de muita discussão, deputados mantiveram parecer da CCJR e aprovaram LDO em primeira votação.
56,o ex-gestor foi condenado a devolver o valor de R$ ,4 milhões. leia mais
57,Apenas % dos municípios do AM estão com transparência elevada e % com situação mediana. leia mais
58,Difícil aderir a um programa que você não sabe o que é, diz secretário de SP sobre escolas cívico-militares
59,Após prisão de auditores, Gilmar Mendes prepara processos contra integrantes da Receita
60,Bolsonaro paga o preço da antipolítica com juros e correção
61,“Tá com sua mãe”, diz Bolsonaro ao ser perguntado sobre Queiroz; veja vídeo
62,Por comando do MDB, novo presidente abre espaço a concorrentes na direção da sigla
63,Integrantes da equipe econômica admitem desgaste entre Guedes e Planalto
64,Sergio Moro tem estratégia permanente de acuar instituições, diz Maia
65,Conheça os investigados pela PF por suspeita de hackear contas de autoridades
66,Investigação quer esclarecer se houve pagamento por conversas hackeadas
67,Relatos de milagres de Irmã Dulce vão de cegueira a unha encravada
68,Ex-assessor e planilha implicam Bolsonaro e ministro em caixa dois
69,O direito difuso concentrou interesses
70,Protagonismo de Luciano Huck gera incômodo em movimento de renovação
71,Olhar ambiental com Sínodo da Amazônia resgata atuação social do papa
72,Núcleo de investigação anunciada pela Lava Jato está no Google desde
73,Na cultura, governo asfixia críticos e monta máquina de propaganda
74,Proposta de Moro de prisão em ª instância deve gerar resistência no STF
75,Excluir mulheres da igreja é nonsense, diz assessor do papa para a Amazônia
76,Senado aprova MP que visa agilizar venda de bens apreendidos de traficantes
77,Após sete votos, STF adia conclusão de julgamento sobre anistia a ex-cabos
78,Bolsonaro diz que permanece no PSL e compara crise no partido a briga de marido e mulher
79,Grupo de deputados do PSL busca saída jurídica para deixar partido se Bolsonaro decidir sair
80,TRF-4 mantém condenação do eeputado André Vargas na Operação Lava Jato
81,Senado aprova mecanismo para facilitar empréstimos a micro e pequenas empresas
82,TRF-2 autoriza viagem de Temer à Inglaterra para dar palestras
83,TCU decide manter suspensão de campanha publicitária que promove o pacote anticrime
84,Vaticano confirma cúpula de governadores da Amazônia para o próximo dia
85,Aras decide manter procuradores do grupo de trabalho da Lava Jato que atua no Supremo
86,TRF-4 reduz dias da pena de José Dirceu em processo da Operação Lava Jato
87,Bolsonaro recebe deputados do PSL após criticar presidente do partido
88,Seis estados do Nordeste são os que mais perdem com novo texto da cessão onerosa
89,Paula e Simp não se entendem e greve pode ser retomada Reunião manteve impasse entre prefeita e sindicato dos servidores sobre pagamento dos salários; assembleia hoje avalia nova paralisação. Acesse (Foto: Carlos Queiroz - DP)
90,Câmara aprova em primeiro turno PEC que cria polícias penais
91,Relator na Câmara lê parecer que autoriza empresas privadas no serviço de saneamento básico
92,Aceno de Bolsonaro ao PSL é apenas uma trégua
93,Entenda como será a divisão entre estados e municípios de recursos do megaleilão de petróleo
94,Câmara aprova projeto que define distribuição de recursos do megaleilão de petróleo
95,NÃÃÃÃÃO tô falando de Chico ou Raimundo, de governador ou presidente. . A vai muuuuuuuito além dos currais eleitorais e dos políticos tradicionais. É a arte de negociar. . TODOS nós somos políticos.
96,Não tem lógica atacar o PSL enquanto o PT está comprovadamente envolvido com o PCC. Provavelmente o enfraquecimento do PSL seja a última cartada daqueles que pretendem derrubar o Presidente. O futuro dirá.
97,Piada pronta , se não fosse tão trágico !!!
98,Não quero tomar o PSL de ninguém, diz Bolsonaro sobre atritos com Bivar
99,Bolsonaro diz não querer tomar partido de ninguém e defende transparência nas contas do PSL
