id;created_at;text;retweet_count;favorite_count
1044650555774304256;2018-09-25 18:11:15;RT @Clauwild1: O candidato das redes sociais agora é o candidato das ruas – Jornal Hora Extra https://t.co/XcZViuRUFv Está no visual! Mas s…;1739;0
1044640408263905283;2018-09-25 17:30:56;https://t.co/WsqQmLFJEH;5451;23311
1044561511031730176;2018-09-25 12:17:25;BOLSA-FAMÍLIA: https://t.co/5KEq8pXeeX;4638;21306
1044537300036833280;2018-09-25 10:41:13;@ru4nkl3in Bom Dia! 👍🏻;18;263
1044396932599353344;2018-09-25 01:23:27;RT @FlavioBolsonaro: Conversávamos sobre isso ontem. E também sobre o “esquecimento” da mídia quanto às agressões de Alckmin e Ciro a eleit…;3172;0
1044393934259187712;2018-09-25 01:11:32;Obrigado pela consideração, Mestre Oswaldo Alves. Um dos mais respeitados guerreiros da história no mundo das artes marciais (Jiu-Jitsu). É uma honra! https://t.co/MsxdlQL1uL;4361;22170
1044377773995905025;2018-09-25 00:07:19;Assista aqui nossa conversa sobre o atentado com @augustosnunes no Hospital Albert Einstein. https://t.co/JQEyAxSRQ9;3134;12753
1044376971369750533;2018-09-25 00:04:08;Sempre a pregação do “amor e da verdade” do jornalismo da Folha de SP. https://t.co/L0mqHPv8HH;3199;14576
1044364902826160128;2018-09-24 23:16:10;Jair Bolsonaro recebe visita de seu candidato ao Senado em São Paulo, @majorolimpio (177) 👍🏻 https://t.co/Q6MKLgvRR3;2078;15391
1044335476877004800;2018-09-24 21:19:15;Assista à entrevista com #BolsonaroNaJovemPan às 18h30 em #OsPingoNosIs, em https://t.co/1r5qTS6hvA.;3246;14275
1044298528326144003;2018-09-24 18:52:25;Carlos Verezza visita Jair Bolsonaro. https://t.co/R6EJ52Hbds;7789;37324
1044256492109647873;2018-09-24 16:05:23;🇧🇷👍🏻 https://t.co/N7mah6JSVz;3883;27643
1044163347720081415;2018-09-24 09:55:16;Antes de qualquer resultado, temos encontrado nomes qualificados para compor nosso time. Na prática, é a garantia de uma equipe comprometida com interesses da nação e não com indicações de lideranças de partidos políticos, o que tem mantido o Brasil na lama nos últimos governos.;7438;39794
1044051358540845056;2018-09-24 02:30:16;UM TEXTO QUE SEPARA A VELHA DA NOVA POLÍTICA: https://t.co/blSFaecHSB;3122;12263
1043997715909267457;2018-09-23 22:57:06;Incentivos à cultura permanecerão, mas para artistas talentosos, que estão iniciando suas carreiras e não possuem estrutura. O que acabará são os milhões do dinheiro público financiando “famosos” sob falso argumento de incentivo cultural, mas que só compram apoio! Isso terá fim!;8709;34172
1043988207044612096;2018-09-23 22:19:19;A indignação $eletiva e a de$one$tidade de alguns: https://t.co/a2ehTyBeHw;11283;37741
1043947334458052609;2018-09-23 19:36:54;- Domingo (23/09/2018) em Copacabana. Obrigado meu garoto @FlavioBolsonaro ! Um forte abraço Rio de Janeiro! https://t.co/jHNdiAfrON;5152;24431
1043878096783527937;2018-09-23 15:01:47;Jair Bolsonaro recebe visita de Paulo Guedes! Sempre juntos na busca da Ordem e Progresso! https://t.co/q8mGhznPbu;5950;37227
1043792566695710720;2018-09-23 09:21:55;@JJSA99991334 Bom Dia 👍🏻.;61;1420
1043791441733062656;2018-09-23 09:17:27;Assumi compromisso de reduzir número de ministérios, extinguir e privatizar grande parte das estatais que hoje existem. São gastos desnecessários que devem atender a população. Recusar acordões que negociam cargos em troca de apoio já faz parte deste objetivo. 🇧🇷👍🏻;10251;50608
1043674560875442177;2018-09-23 01:33:00;Desrespeito com os pobres é deixar as crianças sem merenda nas escolas. Boa noite a todos!;14680;71246
1043666899438047232;2018-09-23 01:02:33;Manifestações pelo Brasil. Muito obrigado pelo apoio, confiança e consideração! https://t.co/V5hFIBq2DQ;3869;20000
1043636433590865925;2018-09-22 23:01:30;Pontes e Lacerda - MT, Muito Obrigado! https://t.co/lLgENy3mMd;2344;11674
1043634817815011328;2018-09-22 22:55:05;Um fortíssimo abraço, Cruzeiro do Sul - AC! https://t.co/bY7a5I2UVs;3008;15670
1043631740277919744;2018-09-22 22:42:51;- Obrigado Guabiruba!- Um forte abraço, Santa Catarina! https://t.co/DKDmymIiS4;3062;16525
1043626184607772672;2018-09-22 22:20:46;Meus sinceros agradecimentos, Pará!!! 👍🏻 https://t.co/38LeCpGhXc;2143;12329
1043625230642614273;2018-09-22 22:16:59;Vamos juntos, SP! https://t.co/HaE69B2Lnq;1367;7793
1043624692781846534;2018-09-22 22:14:51;Um forte abraço ao Ceará! https://t.co/YJGTJdOKCT;1896;10656
1043624296139112448;2018-09-22 22:13:16;Obrigado, Rio de Janeiro! https://t.co/PpIRtWw3MM;1970;9868
1043624023794634753;2018-09-22 22:12:11;Um forte abraço, Paraná! https://t.co/2pj3QQs6yO;1681;8121
1043623637704736768;2018-09-22 22:10:39;Obrigado, Minas Gerais! 🇧🇷👍🏻 https://t.co/0xOnfXumuq;2622;12939
1043584916376772608;2018-09-22 19:36:47;- Obrigado João Pessoa!- Um forte abraço, Paraíba! https://t.co/HZlflaqpWW;5949;31441
1043442381222277120;2018-09-22 10:10:24;@HeltonO52089192 👍🏻👉🏻👉🏻;52;938
1043437036244480000;2018-09-22 09:49:10;@usagifluffy 🌷👍🏻Bom Dia!;39;669
1043436822045569025;2018-09-22 09:48:19;Há tempos temos percorrido o Brasil, de Norte a Sul, conhecendo as peculiaridades de cada região. Não nos importamos com nosso país apenas em períodos eleitorais com o oportunismo político habitual. Sempre construímos a confiança no olho a olho! Juntos vamos resgatar nossa nação!;5990;31781
1043307760887242753;2018-09-22 01:15:28;ENTENDA O QUE É PRECONCEITO: https://t.co/PEeL5xqrmJ;7029;25013
1043268954033188864;2018-09-21 22:41:16;Menos impostos e desburocratização! É preciso parar de sufocar quem produz. Enquanto os adversários mentem e se preocupam somente com o poder a qualquer custo, nosso time foca no futuro do país! https://t.co/3qpYRKp5EO;8070;31794
1043261928775344128;2018-09-21 22:13:21;RT @CarlosBolsonaro: A ESCOLHA É DOS SENHORES! https://t.co/R9Pr1TzS2V;4452;0
1043159966281023488;2018-09-21 15:28:11;Uma má notícia a quem só restou torcer contra minha saúde e recuperação: Nunca me senti tão feliz e bem! Estamos voltando para, juntos, fazermos do Brasil uma grande nação! 🇧🇷 https://t.co/HIQXfQ1gJN;18302;79698
1043098457370714112;2018-09-21 11:23:46;Votei pela revogação da CPMF na Câmara dos Deputados e nunca cogitei sua volta. Nossa equipe econômica sempre descartou qualquer aumento de impostos. Quem espalha isso é mentiroso e irresponsável. Livre mercado e menos impostos é o meu lema na economia!;10594;38226
1043091585259524096;2018-09-21 10:56:28;Enquanto adversários dedicam seus milhões em campanha a ataques covardes contra nós, o Brasil sofre com 60 mil homicídios por ano, 14 milhões de desempregados, 50 mil estupros. Essa é a diferença. A preocupação deles é com o poder a qualquer custo. A nossa é com o futuro do país!;12116;42291
1042954763732754433;2018-09-21 01:52:47;Obrigado, Moleque! Um abraço Sorocaba! 👍🏻 https://t.co/EQA8Iq8pXR;3202;19563
1042924655034679296;2018-09-20 23:53:09;@OravodeCaralho 👍🏻;66;1269
1042918946729603072;2018-09-20 23:30:28;Tentaram nos tirar da disputa na covardia, mas o esforço de cada um, mesmo no momento mais crítico, só nos ergue ainda mais. Estamos mostrando que é possível vencer sem vender a alma, sem mentiras, e isso ninguém vai apagar! Vamos em frente! Chega de facções comandando o Brasil! https://t.co/cd5vz8BeJD;14330;62626
1042889827308527621;2018-09-20 21:34:45;@amnom2001 @g1 👍🏻;18;136
1042733113716158465;2018-09-20 11:12:02;O brasileiro desta vez tem a opção de escolher alguém que pegue firme contra a violência, a favor do livre mercado, contra o aborto e a doutrinação ideológica na educação, livre de acordões políticos e a favor da redução da maioridade penal. Mudaremos juntos a direção do Brasil!;12003;52321
1042716569208606725;2018-09-20 10:06:17;Vamos 🇧🇷!!! https://t.co/BSbRa5BIxN;4645;20677
1042568224670445574;2018-09-20 00:16:49;Depois de 4 homens, uma menina mudou minha vida! É para essas crianças que sempre lutarei! https://t.co/pcLPUlf4SH;7101;32864
1042563605839925249;2018-09-19 23:58:28;pretendemos* 👍🏻;792;9481
1042563003722420225;2018-09-19 23:56:04;@misscaviar 👍🏻;97;2030
1042562665124716545;2018-09-19 23:54:43;Ignorem essas notícias mal intencionadas dizendo que pretendermos recriar a CPMF. Não procede. Querem criar pânico pois estão em pânico com nossa chance de vitória. Ninguém aguenta mais impostos, temos consciência disso. Boa noite a todos! 👍🏻;12979;49026
1042433640418947072;2018-09-19 15:22:02;Agradeço a todos que estão demonstrando apoio das mais variadas formas. É surpreendente a força que isso nos dá para seguir em frente (Com @CarlosBolsonaro ). 🇧🇷👍🏻 https://t.co/U0MgUyNa3e;6726;43120
1042358624675405824;2018-09-19 10:23:56;Nossa equipe econômica trabalha para redução de carga tributária, desburocratização e desregulamentações. Chega de impostos é o nosso lema! Somos e faremos diferente. Esse é o Brasil que queremos!;10037;46604
1042251441019252736;2018-09-19 03:18:02;RT @flaviomorgen: Hashtag #QuemMandouMatarBolsonaro chega ao topo dos Trending Topics mundiais e mídia ignora: https://t.co/VKVhYXJ8B8 http…;2024;0
1042143207696617472;2018-09-18 20:07:57;Nossa constituição será o mapa e os princípios liberais serão a bússola para navegarmos no caminho da prosperidade. Nós temos os fundamentos e as pessoas certas para, finalmente, trazer ao nosso país os valores que estampam a nossa bandeira verde e amarela: Ordem e Progresso!;8999;42885
1041999444940677120;2018-09-18 10:36:41;"ECONOMIA e GOVERNABILIDADE: Com a descentralização do poder dirimimos as suspeitas relações promíscuas entre Federação, Estado e Município; combatendo os problemas peculiares de cada região, facilitando ao cidadão a fiscalização na aplicabilidade dos recursos públicos.";4639;24926
1041980417644158976;2018-09-18 09:21:05;MAIS UM FAKE NEWS DESCARADO! O cidadão apontado na Veja Online de hoje, NUNCA esteve lotado em meu gabinete! https://t.co/frBwPRZaTC;3822;13913
1041764118112419840;2018-09-17 19:01:35;Resumir a atuação parlamentar à aprovação de leis, ou é sinal de incompetência para entender como funciona o poder legislativo, ou é má fé para induzir as pessoas ao erro, ou vício em modelos de governo que resultam em mecanismos como o mensalão.;3181;16929
1041763926596362242;2018-09-17 19:00:49;Se aprovar leis fosse o mais importante, o Brasil seria um paraíso. O que não faltam aqui são leis, muitas delas inúteis. Fazemos nossa parte propondo penas mais duras para estupradores, redução da maioridade penal, etc, mas também impedindo que leis ruins sejam passadas adiante.;7687;37433
1041626313013035008;2018-09-17 09:54:00;Bom Dia! O Brasil tem potencial turístico ímpar no mundo, porém sufocado pela violência, falta de infraestrutura e ativismo ambiental.  A Baía de Angra dos Reis, por exemplo, poderia ser a Cancun brasileira em economia, já que em beleza, para muitos é superior. https://t.co/ADfU0K5O5Q;4194;23712
1041508868390641664;2018-09-17 02:07:19;Agradeço aos movimentos espontâneos espalhados por todo o Brasil neste final de semana por minha recuperação. Tenham certeza que isso nos dá forças para cumprir nossa missão! Vamos mudar o Brasil! Muito obrigado a todos! 👍🏻 https://t.co/r5OQMaN9ZS;6461;31169
1041429710247522310;2018-09-16 20:52:46;O Facebook está marcando como SPAM quem tenta compartilhar a live de Jair Bolsonaro feita há pouco. Disponibilizamos a íntegra no Youtube como alternativa a essa censura! Assista e compartilhe: https://t.co/3MCbzAcuHM;7751;27472
1041423956044079104;2018-09-16 20:29:54;Após atentado Bolsonaro fala ao público pela primeira vez. Assista aos assuntos que foram tocados. https://t.co/g80pxwk8Hs;3223;15210
1041405520320647168;2018-09-16 19:16:39;Assim que terminarmos a live no Facebook a disponibilizaremos em nosso canal no youtube: https://t.co/CuibCiXehH;1448;8599
1041398127583027202;2018-09-16 18:47:16;Com autorização da equipe médica do Hospital Albert Einstein, hoje às 16:50 farei uma live para falar com todos! Até lá! Um forte abraço! 👍🏻 https://t.co/VpAAP35io7;4638;22671
1041268992176996352;2018-09-16 10:14:08;Você não vê, qualquer um destes que me acusam de ser contra a democracia se posicionarem contra o controle da mídia e internet. A maioria deles inclusive, agindo contrariamente à liberdade de expressão.;3067;16051
1041262281714225154;2018-09-16 09:47:28;CONTROLE DA INTERNET mais a REGULAÇÃO DA MÍDIA tem como principal objetivo de barrar o crescimento de veículos independentes sob o pretexto de combater “fontes não seguras” e assegurar “jornalismo sério”, calando aqueles que não estiverem alinhados à agenda globalista.;5519;25421
1041252249958313985;2018-09-16 09:07:36;RT @jairbolsonaro: Nos últimos anos o PT doou bilhões para ditaduras amigas via BNDES. Seu dinheiro que deveria ser utilizado de forma resp…;8706;0
1041140722479624192;2018-09-16 01:44:26;RT @jairbolsonaro: Como já foi falado, reafirmo aqui meu compromisso de extraditar o terrorista Cesare Battisti, amado pela esquerda brasil…;7530;0
1041124474391801856;2018-09-16 00:39:52;Pequeno documentário produzido pelo Deputado Federal Eduardo @bolsonarosp em passagem por Roraima com objetivo de retratar a crise migratória de venezuelanos no Norte do Brasil. Assista: https://t.co/T9x0wjkQrw;2127;10057
1041122032103116801;2018-09-16 00:30:10;Pombos* 👍🏻;575;6531
1041107930119106560;2018-09-15 23:34:08;Essa é nossa diferença! Enquantos uns gastam dezenas de milhões em campanha, nós temos milhões de voluntários movidos pelo sonho de um Brasil mais justo, com segurança e oportunidades. Obrigado povo de Pombo - PE! Obrigado Nordeste! https://t.co/mBJlAefszZ;6092;30808
1041075445389840385;2018-09-15 21:25:03;Vamos juntos, irmãos Venezuelanos! 🇧🇷🇻🇪 https://t.co/FwVqKh3PjL;2421;11878
1041044562909777920;2018-09-15 19:22:20;Deus no comando! 🇧🇷 https://t.co/ROLF2rd9fO;6185;47513
1041043166626033666;2018-09-15 19:16:47;Obrigado pelas palavras, Senhor Ministro do Interior da Itália! Que em 2019 o Brasil possa fortalecer as relações com a Itália e com mais países livres e democráticos no mundo. https://t.co/fGCoX2Mkxy;4367;21738
1041023242109108225;2018-09-15 17:57:36;Obrigado pela consideração, Mulheres de todo o Brasil! https://t.co/p2eTLJnRkQ;5415;32394
1040930680337850368;2018-09-15 11:49:48;Servimos como fonte do plano de poder do Foro de SP e ainda somos vítimas das mazelas causadas por seus líderes. Além de 14 milhões de brasileiros desempregados, hoje todos sofrem com a crise migratória causada por Maduro no Norte do Brasil, região visitada por nós recentemente.;2866;14506
1040930442243960832;2018-09-15 11:48:51;Nos últimos anos o PT doou bilhões para ditaduras amigas via BNDES. Seu dinheiro que deveria ser utilizado de forma responsável para nosso crescimento, serviu pra alimentar governos autoritários e antidemocráticos como Cuba e Venezuela, sem nos dar retorno algum. Isso vai acabar!;8706;35080
1040927635361226754;2018-09-15 11:37:42;Bom Dia a todos! 👍🏻;1442;13577
1040803587713126400;2018-09-15 03:24:47;A rejeição só aumenta a cada dia! https://t.co/cfJvx2SFYg;7629;32548
1040743790061998081;2018-09-14 23:27:10;Passada essa nova cirurgia, hoje foi possível dar uma caminhada sem maiores problemas. Espero estar apto a fazer flexões em breve kkk. Boa noite a todos! 👍🏻🇧🇷;9267;62406
1040722156718575616;2018-09-14 22:01:12;Vamos mudar o Brasil! https://t.co/WR551u64JS;6251;22804
1040661962273775617;2018-09-14 18:02:01;Vamos evoluindo a cada instante! 🇧🇷👍🏻 https://t.co/ee3cmYltWi;4533;22763
1040538438188101634;2018-09-14 09:51:10;Estivemos em Israel e vimos de perto o que eles não tem e o que eles são, mesmo no meio do deserto. O Nordeste brasileiro tem grande potencial para produzir, gerar empregos e prosperar, principalmente quando falamos em agricultura e energia limpa. É onde pretendemos avançar!;7984;41226
1040369620346122241;2018-09-13 22:40:21;Muita coisa vem sendo falada na tentativa de nos dividir e consequentemente nos enfraquecer. Não caiam nessa! Desde o início sabíamos que a caminhada não seria fácil, por isso formamos um time sólido e preparado para a missão de mudar o Brasil! Não há divisão!;10080;47016
1040347205989744645;2018-09-13 21:11:17;🇧🇷👆🏻👉🏻👉🏻 https://t.co/1EPQq1lqKy;4827;31417
1040332132684623874;2018-09-13 20:11:23;Aos que se preocuparam e fizeram suas orações na noite passada o meu muito obrigado! Tudo correu bem, graças a Deus e aos que estão cuidando de minha saúde e recuperação, faxineiros, enfermeiros, psicólogo, fisioterapeuta e médicos. Seguimos firmes! 👍🏻;7789;53343
1040005795289681920;2018-09-12 22:34:38;Meu filho,@BolsonaroSP , reuniu as informações e entregou esta bacana homenagem! Vamos sair dessa! Muito Obrigado a todos! https://t.co/xXzWoUBIQt;7883;34662
1039880166225453058;2018-09-12 14:15:26;Por outro lado, alunos têm sofrido lavagem cerebral carregada de inversão de valores, fruto de um histórico Ministério da Educação com indicação política, viés ideológico e incapacitado. Nossa posição no PISA reflete isso. Daremos os primeiros passos para reverter este quadro!;3120;17123
1039867625835323392;2018-09-12 13:25:36;Infelizmente o professor e a professora hoje perderam sua autoridade em sala de aula. São muitos os relatos e registros de agressão, desrespeito e humilhação. Resgatar essa autoridade também é uma forma de valorizá-los. É preciso disciplina para avançarmos neste campo!;6513;33930
1039859861641732096;2018-09-12 12:54:45;"Cotado para ser presidente da Comissão de Direitos Humanos em 2014, deixei claro: se escolhido, seria ""daltônico"", todos teriam a mesma cor! Devemos lutar para que  sejamos iguais perante a lei. Com um governo comprometido com o Brasil, não com partidos, todos terão oportunidade! https://t.co/gki1UWgtCJ";4126;18515
1039671448380612608;2018-09-12 00:26:04;Não são poucas as vezes que achamos que é o fim. Ninguém está imune a isso, mas todos podemos nos reerguer e seguir adiante. Não deixemos que nos digam que é impossível vencer sem trapaças, sem vender a alma. Isso pode ser alcançado se partir de cada um de nós. Boa noite a todos!;9189;45906
1039656977964716032;2018-09-11 23:28:34;Muito obrigado pelas valiosas palavras, Professor @OdeCarvalho ! Que Deus continue abençoando seu brilhante trabalho que desperta a paixão pela cultura no coração de tantos brasileiros. Um forte abraço! https://t.co/r2PAmE2Gnz;6864;28066
1039640051142074369;2018-09-11 22:21:18;Apoiar a Lava Jato é fundamental no combate à corrupção no Brasil. O fim da impunidade é uma das frentes que estanca o problema, outra é atacar a corrupção na sua raiz, pondo fim nas indicações políticas do governo em troca de apoio. Nós temos a independência necessária para tal!;6172;28576
1039609626982051840;2018-09-11 20:20:24;RT @STF_oficial: Por 3 votos a 2, a 1ª Turma do STF rejeitou denúncia contra o deputado federal Jair Bolsonaro, denunciado pela PGR pelo su…;4448;0
1039509577593573378;2018-09-11 13:42:51;"A segurança é nossa prioridade! É urgente! As pessoas precisam de emprego, querem educação, mas de nada adianta se continuarem sendo vítimas de latrocínio a caminho de seus trabalhos; de nada adianta se o tráfico de drogas permanecer na porta das escolas.";4031;18022
1039506148045582337;2018-09-11 13:29:13;"O Brasil mostrado nas propagandas eleitorais está longe de ser o que vivemos na realidade. Enquanto marketeiros formulam palavras bonitas e narram um conto de fadas, as pessoas estão presas dentro de suas próprias casas; mães esperam angustiadas pela chegada de seus filhos.";6872;29827
1039462267706851328;2018-09-11 10:34:51;Nada apagará a chama da esperança que presenciamos nos olhos de cada um presente neste grande dia! Obrigado Juiz de Fora! Obrigado Minas Gerais! https://t.co/A22Q7PpYGU;5869;27767
1039262142237732864;2018-09-10 21:19:37;Acomodados com a velha política suja, muitos duvidaram de nossa seriedade numa disputa presidencial. Hoje temos um respeitável e crescente time, cujo centro das ideias une conservadores, liberais, cristãos, ateus e outros muitos, visando um bem comum: o Brasil e nossa liberdade!;7693;38545
1039203609051836416;2018-09-10 17:27:02;Agradeço a cada cidadão, pai, mãe, filho e filha, pelos atos de solidariedade realizados nos últimos dias. Este apoio é nosso combustível. Tenho me comunicado menos por conta da recuperação, sendo auxiliado por um de meus filhos. Muito obrigado a todos! Nós vamos mudar o Brasil! https://t.co/wbmSbYAfWc;7758;35839
1038858782732898304;2018-09-09 18:36:49;@Waynna_Dias Muito obrigado pela linda homenagem, Waynna!;45;545
1038857046467256326;2018-09-09 18:29:55;Continuamos à frente na disputa, contando com a espontânea ajuda de sempre que parte de cada um de nós, dentro das condições possíveis. De forma alguma estamos fora do pleito! Não daremos esse gosto a quem desejou este desfecho! Brasil Acima de Tudo! Deus acima de todos!;10279;51041
1038787189751132160;2018-09-09 13:52:20;Difícil não se encantar e não se emocionar. Muito obrigado pela homenagem, Débora Maciel! Logo estaremos 100%! https://t.co/FlrsUPF8hM;3863;23851
1038495278297477125;2018-09-08 18:32:23;Boa tarde! Novamente gostaria de agradecer as orações e votos de apoio, carinho e consideração! O momento nos une e fortalece. Estamos em boas mãos. Aproveito para lembrar que tão grave quanto a corrupção, é tentar roubar a nossa liberdade.;10576;61680
1038112690143731712;2018-09-07 17:12:07;Agradeço do fundo do meu coração a Deus, minha esposa e filhos, que estão ao meu lado, aos médicos que cuidam de mim e que são essenciais para que eu pudesse continuar com vocês aqui na terra, e a todos pelo apoio e orações!;10070;64387
1038110967429771264;2018-09-07 17:05:16;Estou bem e me recuperando! 👍🏻;16815;103594
1037741018337210369;2018-09-06 16:35:13;"Queremos manter os incentivos à cultura, mas para bons artistas que agregam valor, que estão iniciando suas carreiras e não possuem estrutura. O que deve acabar é dinheiro publico financiando absurdos como oficinas de masturbação ou ""peças"" com pessoas cutucando seus orifícios!";5789;32590
1037730756930555905;2018-09-06 15:54:27;Impunidade, desarmamento, indicações políticas e corrupção geraram e continuam alimentando os maiores problemas do Brasil: violência, ineficiência do Estado e desemprego. Tão importante quanto fazer coisas novas, é desfazer essa estrutura criminosa criada pelos últimos governos!;3380;16539
1037714404979163137;2018-09-06 14:49:28;Para saber o que acredito e defendo, acesse: https://t.co/yvI9KznFUU 👍;2182;9561
1037689914765320192;2018-09-06 13:12:09;Na Câmara, sempre votei ao lado de minha consciência, de acordo com o contexto de cada situação. Ser citado no STF como o único da base que não se vendeu no mensalão prova isso. Não tem essa de igual ao PT. Se fosse verdade, o próprio PSDB sinalizaria apoio a mim em um 2° turno.;2783;14005
1037642273511690241;2018-09-06 10:02:51;Ele tem razão, sou o mais despreparado para roubar os cofres públicos (merenda escolar, por exemplo), ou melhor, não tenho preparo nenhum. https://t.co/8kGtkC1sXV;5197;20542
1037635294768640000;2018-09-06 09:35:07;O excesso de burocracia e interferência do governo trava o desenvolvimento do Brasil. Alguns pontos sobre o assunto: https://t.co/rPNWtYPtGM;1191;6213
1037485508140703746;2018-09-05 23:39:55;General Heleno expõe sua experiência de campo no Roda Viva. https://t.co/DXRtaLlauj;1149;5953
1037416845660311552;2018-09-05 19:07:04;Mais verdades sobre a possibilidade de fraudes nas urnas eletrônicas. https://t.co/XxwnrYaRqf;3443;12721
1037328076064124928;2018-09-05 13:14:20;Obrigado Distrito Federal! Com @bolsonarosp @Biakicis e @GenPauloChagas https://t.co/Xnhg0PpQw6;2173;11029
1037254860633264128;2018-09-05 08:23:24;Discurso final do meu Vice, General Mourão, no debate promovido pela Veja. Vamos mudar o Brasil! https://t.co/IeSOssYCPL;3696;13844
1037149030567108608;2018-09-05 01:22:52;Vale lembrar que o Brasil não é uma facção criminosa para ser comandado de dentro da cadeia. Boa noite a todos! 👍🏻;13272;50100
1037144438890553345;2018-09-05 01:04:38;Em sua nova propaganda eleitoral, PSDB sugere que militares seriam todos incompetentes! https://t.co/t7TxHJlhii;1518;6665
1037132891204005888;2018-09-05 00:18:44;@filgmartin @FlavioBolsonaro Bem lembrado, Filipe. 👍🏻;89;1323
1037130914088857602;2018-09-05 00:10:53;Já a chamada da @UOL refere-se à minha resposta ao comentário idiota de seu jornalista sobre o Museu ter sofrido um incêndio. Pura demagogia! Enquanto procuram problema em minhas palavras, fecham os olhos para os verdadeiros responsáveis pela destruição nosso Brasil!;1952;9802
1037130800200921091;2018-09-05 00:10:26;Sobre o Museu Nacional e nosso patrimônio histórico, respondi à imprensa que as indicações políticas em troca de apoio são os maiores causadores da má administração pública e que nossa ação neste caso seria acabar com essa rotina que visa apenas interesses pessoais e partidários.;2684;12676
1037121737719246848;2018-09-04 23:34:25;O amor combate o ódio! Espalhemos poesia e não preconceito! https://t.co/6O2yekYoRQ;4695;16953
1037118342551797760;2018-09-04 23:20:56;Grato pela reflexão e consideração, @andrevaladao . https://t.co/jexU6Y30Ue;819;4157
