id;created_at;text;retweet_count;favorite_count
1056678584708931584;2018-10-28 22:46:21;Desejo que ele seja bem sucedido nessa missão e que possamos caminhar no rumo certo e na construção de um Brasil melhor para todos os brasileiros.;584;4844
1056678555046821889;2018-10-28 22:46:14;-Cortando privilégios, abrindo mão de morar em palácio, diminuindo os custos do planalto e da Alvorada e reduzindo drasticamente os cargos comissionados.;363;3699
1056678472737800195;2018-10-28 22:45:54;-Na montagem de um governo que funcione, com profissionais tecnicos e qualificados, metas e objetivos, uso de tecnologia e transparência e possa, assim, atender as demandas existentes na educação básica, segurança e saúde.;226;1773
1056678402739068928;2018-10-28 22:45:38;-Na criação de um novo ambiente de negócios que seja propicio a criação de empregos e o empreendedorismo, com reformas que facilitem a abertura de empresas, a contratação de funcionários, o calculo de impostos, a segurança jurídica e a redução da burocracia.;241;1824
1056678245737869312;2018-10-28 22:45:00;O Brasil tem pressa. O Congresso e o novo Presidente devem ter esse senso de urgência.Espero que o presidente Bolsonaro paute a sua atuação inicial em pelo menos 4 áreas:-No equilíbrio das contas públicas, com a reforma da previdência, privatizações e gestão profissional.;406;2680
1056678101369925632;2018-10-28 22:44:26;Gostaria de cumprimentar o deputado Jair Bolsonaro pela eleição ao posto máximo da nação brasileira. A partir de agora ele deixa de ser o candidato de muitos brasileiros, para ser o presidente de todos com a missão de unir o País. https://t.co/ClDggG81Kd;3427;22310
1056672878693941248;2018-10-28 22:23:40;O NOVO, com 3 anos de existência, sem coligação e sem utilizar dinheiro público elege em Minas, segundo maior colégio eleitoral, o seu primeiro governador.Uma pessoa séria, comprometida, que saiu da zona de conforto. Uma vitória para todos que desejam renovação na política. https://t.co/kan7bbCslK;3269;23119
1056315209873285120;2018-10-27 22:42:26;"RT @OGloboPolitica: Datafolha MG: @RomeuZema30 aparece com 70%; @Anastasia, tem 30% https://t.co/XyTZblGJLW https://t.co/VOim2BuO1v";98;0
1056311568105914369;2018-10-27 22:27:57;As pesquisas deixam claro que os mineiros querem o NOVO. E @RomeuZema30 é o NOVO em Minas Gerais.Domingo, vote 30.https://t.co/TqXXC9XjC8;234;2351
1056305553461395456;2018-10-27 22:04:03;https://t.co/WFMUjSOpLO;519;3719
1056136864996966400;2018-10-27 10:53:45;Amanhã os mineiros votam, mais uma vez, no NOVO.@RomeuZema30 é o NOVO em Minas Gerais. Vote 30. https://t.co/5H2sMEarYa;497;4057
1055911513100292098;2018-10-26 19:58:17;Essas são algumas medidas para o brasileiro não ter mais medo andar na rua:▶️Tecnologia para prevenção de crimes▶️Valorização dos policiais▶️Integração entre governo federal, municipal e estadual▶️Revisão da Lei de Execução Penal▶️Parcerias para a gestão de presídios https://t.co/Jq2vozek8Y;348;1725
1055867455741009920;2018-10-26 17:03:13;Conversarei, junto aos nossos 8 deputados, com o Ministro da Fazenda, Guardia. Na pauta estarão os desafios e reformas necessárias para o Brasil gerar empregos.O NOVO sempre defenderá os interesses dos brasileiros, seguindo nossos princípios e valores.https://t.co/yN8DoWVvrn;122;990
1055851059602735106;2018-10-26 15:58:04;Romeu Zema é o NOVO em Minas gerais. Neste domingo, vote 30.https://t.co/IWUkDyJv8P;118;1068
1055836614684016641;2018-10-26 15:00:40;RT @janainalimasp: Vamos com tudo @RomeuZema30! #novo30 #ondalaranja #vamosrenovartudo #zema #RomeuZema30 https://t.co/A7PNemi2GA;50;0
1055825908580397056;2018-10-26 14:18:07;Ótima entrevista com o @marcelvanhattem , ele priorizará 5 pontos:✅Reformar a Previdência para torná-la justa e sustentável✅Impedir aumentos de impostos✅Privatizações✅Reforma Trabalhista, para ser mais fácil trabalhar✅Cortes de despesa públicahttps://t.co/AMWAnv3qVL;272;2046
1055820780850831360;2018-10-26 13:57:45;RT @gayosoanaluiza: O Anastasia falou que o NOVO é partido de rico. Mas o Romeu Zema gastou R$ 0,15 por voto e o Anastasia R$ 3,33.O di…;1129;0
1055655021147316225;2018-10-26 02:59:04;O final do debate entre o Anastasia e o Zema hoje deixou claro a grande diferença: o primeiro é a velha política, que promete resolver tudo pelo Estado, e o segundo sabe que a realidade é outra. Precisamos de menos Estado, menos burocracia e mais liberdade para prosperarmos.;582;5156
1055531121952391170;2018-10-25 18:46:44;Estas são algumas medidas para termos um governo que não pese tanto nos nossos bolsos. https://t.co/z09yX6cMkp;139;922
1055480635798765568;2018-10-25 15:26:08;Faz sentido um político preso representar a população no Congresso? Não há espaço para essa Bancada da Grade no NOVO Brasil.https://t.co/gvL8fxd2EE;445;2122
1055478810341240832;2018-10-25 15:18:52;RT @mtrindadenovo: Bom dia pessoal. Segue link para artigo que publiquei hoje em O Globo. Cidadania acima de todos https://t.co/f9nbIhS81i;44;0
1055463580022304768;2018-10-25 14:18:21;Não podemos mais atrasar os investimentos necessários em infraestrutura para o Brasil voltar a crescer. O NOVO e nossos 20 deputados irão lutar pelas privatizações e concessões necessárias para o Brasil se desenvolver.https://t.co/MrRhOuPROG;133;1009
1055459569793687552;2018-10-25 14:02:25;https://t.co/x0sN0qkqU7;107;855
1055225050704592897;2018-10-24 22:30:31;Em Minas Gerais @RomeuZema30 é o NOVO.Enquanto o atual governador do PT parcela o salário dos funcionários em 3 vezes, Zema assumiu o compromisso de que ele e seus secretários só receberão salários quando todo os funcionários públicos tiverem recebidoO NOVO Brasil já começou. https://t.co/xkidKGM1Wr;219;1364
1055204602369449984;2018-10-24 21:09:16;Você sabia que seus impostos estão indo para partidos e campanhas políticas?O NOVO é o único partido que não utiliza esses recursos. É por isso que somos mantidos apenas pelos nossos filiados e doadores de forma voluntária.Entenda na série Política em 1 minuto. https://t.co/5kn5f1OyIw;568;2980
1055161336009764864;2018-10-24 18:17:21;Estes são alguns passos necessários para o Brasil voltar a crescer:✅Ajustar as contas públicas✅Reduzir burocracias, especialmente para geração de empregos✅Reforma tributária, reduzindo e simplificando impostos✅Abertura comercial✅Privatizações https://t.co/A7vnuam05O;217;1217
1055128113884155905;2018-10-24 16:05:20;"""Por que isso é tão importante e tão positivo? Muito simples: menos burocracia significa mais geração de riqueza e melhor qualidade de vida.""A luta contra a burocracia é uma das prioridades do NOVO.";230;2153
1055110661188018176;2018-10-24 14:55:59;RT @Ricamconsult: Ou o próximo Presidente e seu governo encaram a corrupção, os privilégios e os gastos públicos de frente, invertendo esta…;211;0
1055106471892078595;2018-10-24 14:39:20;Enquanto aluns grupos continuarem a demandar privilégios, o Brasil não vai conseguir fechar as contas e reduzir os impostos para toda a sociedade. https://t.co/d6RlxDPgni;108;715
1055086504677138432;2018-10-24 13:19:59;Ao tentar fazer tudo, o governo não consegue entregar o básico. O NOVO acredita que o governo deve priorizar o essencial: segurança, educação e saúde. https://t.co/bqxjcOTy7V;138;876
1054861997446180864;2018-10-23 22:27:53;Essas são algumas maneiras que o governo cria desigualdades. O NOVO e nossos eleitos lutarão para mudar essa realidade. https://t.co/3SDYQ4Jtr7;162;887
1054828738339323909;2018-10-23 20:15:43;A falta de saneamento afeta a saúde o trabalho e a educação da população. Especialmente das mulheres.Temos que pensar em soluções. A privatização não pode ser tratada como um tabu e sim com um meio para que todos possam ter serviços de qualidade.https://t.co/A7oJkh8sQ3;117;848
1054792620835258368;2018-10-23 17:52:12;Ótimo editorial. O Brasil deve se abrir para o mundo, realizando mais acordos, exportando e importando mais. Esse tipo e acordo já se provou melhor para a população do que o protecionismo. Foi esse caminho que os países desenvolvidos adotaram.https://t.co/kPCMH0icCG;80;457
1054753335008509953;2018-10-23 15:16:06;O Brasil não precisa de um Estado grande porque é pobre. Ele é pobre justamente porque tem um Estado grande.;651;3004
1054753049456058373;2018-10-23 15:14:58;"""O partido tem uma visão ultraliberal, fora da realidade"",disse o tucano falando do Novo.""Talvez na Suíça, em Dubai pode ser que funcionem,onde tem muito dinheiro.""@Anastasia não entendeu que esses países deram certo justamente pelas políticas liberais.https://t.co/UZJznzSkmE";348;2092
1054712516113297408;2018-10-23 12:33:54;RT @janainalimasp: Parabéns @joaoamoedonovo ! É muito bom ter alguém como você na nossa luta por um Brasil livre e justo! #novo30 #ondalara…;76;0
1054712374110941184;2018-10-23 12:33:20;https://t.co/vzswMkQrLO;442;4600
1054424459589902336;2018-10-22 17:29:16;A previdência é insustentável e já consome mais da metade do orçamento primário. Ou seja, gasta-se mais com a previdência do que com saúde, educação, segurança somados. Queremos um sistema único que corrija as injustiças e que seja sustentável para as futuras gerações. https://t.co/MvmWexmZig;587;2687
1054368716778074112;2018-10-22 13:47:45;O Brasil é um país fechado para o mundo. A população brasileira, especialmente os mais pobres, seriam beneficiados por uma abertura comercial.Precisamos ampliar os acordos de livre comércio com outros países.https://t.co/ABKREWqcAo;338;2389
1054348734958575616;2018-10-22 12:28:21;O excesso de cargos comissionados e de confiança afeta o governo e abre espaço para ineficiência, corrupção e o aparelhamento do estado.Há muito o que cortar. Além da economia teríamos uma gestão pública mais qualificada e menos pautada por interesses próprios. https://t.co/6Rl7xQUYxe;253;1528
1054138866075099137;2018-10-21 22:34:25;"Ótimo editorial do Estadão sobre a presença do liberalismo no debate eleitoral.""A discussão dos valores liberais sempre enriquece o debate público.""https://t.co/qmG4XsuP71";114;853
1054042649852866561;2018-10-21 16:12:05;"Escrevi para a @folha sobre o processo eleitoral deste ano.""A grande maioria dos eleitores caiu na armadilha petista de polarizar a disputa eleitoral antes do tempo e discutir apenas o 'Ele não' X 'PT não'. O resultado não poderia ser bom. ""https://t.co/ot0Kjw4ICP";309;1803
1053999177045368832;2018-10-21 13:19:20;Deveríamos ter discutido:-socialismo não X capitalismo sim-privilégio p/ político não X ajuda a quem mais precisa sim-empresa e monopólio estatal não X livre mercado e concorrência sim-intervenção estatal não X segurança (indivíduo e propriedade) simhttps://t.co/ot0Kjw4ICP;979;6576
1053997594144399361;2018-10-21 13:13:03;Meu artigo hoje:“Precisamos de um modelo de Estado em que o cidadão seja protagonista, que garanta educação e liberdade a todos os brasileiros para que possam trabalhar, empreender e desenvolver seu potencial.”https://t.co/UTMgklkDW5;253;1864
1053696176246132740;2018-10-20 17:15:19;Acabar com dinheiro público para partidos e as distorções decorrentes disso deverá ser uma das prioridades da bancada do NOVO no Congresso.https://t.co/78h8aGgJmL;323;2544
1053672921539993601;2018-10-20 15:42:55;Com o dinheiro que a velha política gastou no primeiro turno seria possível manter 184 mil crianças na escola durante um 1 ano. Para o NOVO dinheiro público não deve ir para partidos e campanhas políticas. E sim para educação, segurança e saúde. https://t.co/VnXpKpaI1G;1096;4767
1053402422440288256;2018-10-19 21:48:03;O dinheiro dos nossos impostos deve ir para educação, segurança, saúde e não para financiar campanhas e partidos políticos. É por isso que nenhum dos candidatos do NOVO usou um centavo de dinheiro público. O NOVO Brasil já começou. https://t.co/HExT58AEW5;567;3148
1053356887712980995;2018-10-19 18:47:07;O Brasil é um país fechado para o mundo. A população brasileira seria beneficiada com a abertura comercial.Junto à abertura, o Governo precisa parar de prejudicar o empreendedor, reduzindo e simplificando impostos e burocracias e melhorando a educação básica e técnica. https://t.co/0U6KWNzBsl;280;1676
1053312496050888704;2018-10-19 15:50:43;Às vésperas do leilão da Cesp, novamente a insegurança jurídica prejudica o desenvolvimento brasileiro. Se esta insegurança afeta grandes investimentos, imagine o pequeno empreendedor. https://t.co/SjrGXfg8Ru;84;551
1053289795269656576;2018-10-19 14:20:31;https://t.co/z4QzKFxWG9;872;5834
1053009732603207681;2018-10-18 19:47:38;Existem duas maneiras de uma empresa receber o seu dinheiro. A boa é quando você decide comprar um bem ou serviço. A ruim é quando a governo dá um subsídio para incentivar uma empresa.Queremos um país sem privilégios, e isso passa pela revisão dos subsídios. https://t.co/zvQKHzXzj9;308;1730
1052957769169559553;2018-10-18 16:21:09;Os militares não podem ficar de fora da reforma da previdência. É necessário atentar às diferenças da carreira militar. Porém, devemos seguir os exemplos de países como Estados Unidos e Reino Unido, que fizeram reformas no regime previdenciário militar.https://t.co/21wTkT4SSZ;459;2588
1052918926244552704;2018-10-18 13:46:48;O NOVO Brasil já começou https://t.co/3ls7uqdfXN;390;2741
1052706265737121792;2018-10-17 23:41:46;Muito obrigado a todos que doaram para a nossa campanha! Sua participação foi fundamental para enfrentarmos a velha política, que usou quase R$2 bilhões de dinheiro público em suas campanhas. Não teríamos chegado tão longe sem a sua contribuição! https://t.co/kI6aAA4Oze;115;1670
1052670451439296513;2018-10-17 21:19:27;Estas são algumas medidas que o NOVO e os deputados eleitos irão trabalhar:✅ Facilitar a abertura de empresas e contratação de funcionários✅ Simplificar e reduzir impostos e burocracias✅Parcerias e privatizações para melhorar a infraestruturahttps://t.co/t428QOPbdM;502;2990
1052642164721602560;2018-10-17 19:27:03;O deputado federal pelo NOVO em São Paulo, @ViniciusPoit , esteve hoje no Pânico na Rádio! https://t.co/353jVs0tsy;36;435
1052629756414312448;2018-10-17 18:37:45;O NOVO acredita que o dinheiro dos nossos impostos deve ir para educação, segurança e saúde, e não para estatais que só dão prejuízo. Não podemos mais pagar essa conta.As estatais não são estratégicas para a população. Elas são estratégicas apenas para a velha política. https://t.co/ecXXgsH4oO;224;1199
1052609130463023104;2018-10-17 17:15:47;RT @joaoamoedonovo: @CorrupcaoMemes @cachorroantiPT A mão de bloquear chega a tremer;1211;0
1052606703290765312;2018-10-17 17:06:09;@CorrupcaoMemes @cachorroantiPT A mão de bloquear chega a tremer;1211;5490
1052605120213606400;2018-10-17 16:59:51;A história do Daniel José​, deputado estadual eleito pelo NOVO com 183 mil votos, é inspiradora e mostra como uma boa educação resulta em um país com mais oportunidades.https://t.co/KgThOAZMnW;211;1856
1052592893523824641;2018-10-17 16:11:16;"Ótima entrevista com o presidente do NOVO, Moisés Jardim:""Esses resultados mostram que nossos princípios e valores estão sendo bem aceitos pelo eleitor e este, por sua vez, está mostrando também que está em busca de algo diferente da velha política.""https://t.co/uPyQ3aX3zy";78;671
1052335507802341376;2018-10-16 23:08:31;As estatais são aparelhadas por políticos e servem como fonte de corrupção, cabide de empregos e caixa dois. Isso ajuda os políticos de sempre a se manterem no poder.A privatização tira poder dos políticos, diminui a corrupção e faz com que a população receba melhores serviços. https://t.co/bTjOVRkx0p;927;4146
1052272391416700928;2018-10-16 18:57:43;O NOVO e seus deputados eleitos estarão em Brasília, apresentando propostas, fiscalizando os gastos e lutando por um governo que priorize o essencial: educação, segurança e saúde. O NOVO Brasil já começou. https://t.co/M7eE4EteAd;217;1712
1052225381934264320;2018-10-16 15:50:55;Vista a camisa do NOVO o ano inteiro! Conheça a nossa loja.https://t.co/hxflweCzOa;53;875
1051970741695074308;2018-10-15 22:59:04;Eu e o NOVO defendemos o fim do Foro Privilegiado e apoiamos a Lava Jato. Precisamos acabar com a impunidade no Brasil, especialmente para os políticos.https://t.co/wDaH4XHPZF;451;4066
1051926930352689153;2018-10-15 20:04:58;O NOVO não usa dinheiro público e é mantido de forma voluntária pelos filiados! Filie-se agora em https://t.co/c1aBH6uYTFRetuíte para a onda laranja ganhar ainda mais força!;166;631
1051926415891996677;2018-10-15 20:02:56;"""Com políticos ideologicamente saudáveis e alinhados ao partido, de forma comprovada em um processo seletivo, e com o compromisso partidário de cortar gastos, abrir mão de privilégios e apertar os cintos, a política do NOVO dispensa os velhos rituais.""https://t.co/MawyqYa66x";136;1295
1051866818535718912;2018-10-15 16:06:06;Graça à força da onda laranja o NOVO cresceu muito nessa eleição. Elegemos 8 deputados federais, 11 deputados estaduais e 1 deputada distrital. Em Minas Gerais, Romeu Zema está no segundo turno!https://t.co/RcI9vIIhg6;399;5261
1051192753550450688;2018-10-13 19:27:37;Romeu Zema está no segundo turno para o governo de Minas Gerais. O NOVO Brasil já começou.https://t.co/0P1Xugd17V;484;4965
1051154559089958912;2018-10-13 16:55:51;Foram mais de 15 milhões de votos em 19 estados! Em nossa primeira eleição nacional elegemos 8 deputados federais, 11 deputados estaduais e 1 deputada distrital. Romeu Zema está no segundo turno para o governo de Minas Gerais.Graças ao voto de vocês o NOVO Brasil já começou! https://t.co/ct2AiSfMdn;405;4106
1051154009128484865;2018-10-13 16:53:39;RT @Ricamconsult: “Preste atenção a seus pensamentos. Eles vão se tornar atos.Preste atenção a seus atos. Eles vão se tornar hábitos.Pres…;2865;0
1050817183150993411;2018-10-12 18:35:14;Romeu Zema, candidato ao governo de Minas Gerais pelo NOVO, disparou na pesquisa de segundo turno! O NOVO Brasil já começou! https://t.co/2nbEo4LdJE;607;4909
1050758456536231936;2018-10-12 14:41:52;Minas quer o NOVO e manda um recado à velha política.Nunca um lema fez tanto sentido: Libertas, quæ sera tamen, ou, Liberdade ainda que tardia. https://t.co/3tpyqNwtdp;880;7483
1050394623280058368;2018-10-11 14:36:08;Gustavo Franco, o pai do plano Real, esteve a frente do nosso plano de governo e agora será o coordenador econômico de Romeu Zema, candidato ao governo de Minas Gerais pelo NOVO, que está no segundo turno. O NOVO Brasil já começou.https://t.co/wnjvwsLTt0;971;7960
1050062559917875200;2018-10-10 16:36:38;RT @partidonovo30: Venha para o único partido que vai mudar a forma de fazer política no Brasil. O NOVO é mantido de forma voluntária pelos…;222;0
1050048724511191041;2018-10-10 15:41:39;Mesmo com 1 milhão de assinaturas pedindo minha participação nos debates, as emissoras não convidaram o NOVO. Mas graças à força da onda laranja elegemos 8 deputados federais e o NOVO estará presente nos debates de 2020 e 2022! O NOVO Brasil já começou.https://t.co/mBzQFzB99l;1326;13642
1050046028731297792;2018-10-10 15:30:56;O NOVO elegeu 8 dep. federais, 11 dep. estaduais e 1 dep. distrital.Eles vão lutar por um Brasil mais simples,com menos burocracias, onde seja mais fácil trabalhar e empreender.Sua participação continua sendo fundamental para construir esse NOVO Brasil.https://t.co/kyRnwoAJSz;186;1928
1050028317611577344;2018-10-10 14:20:34;@ChristianProf_;1;71
1049720803682656256;2018-10-09 17:58:37;O NOVO elegeu 11 deputados estaduais e 1 deputada distrital este ano! São 12 eleitos para construir um NOVO Brasil em seus estados e no DF.Parabéns a eles, que se colocaram à disposição para lutar um país melhor, e a todos que votaram pela renovação que o Brasil tanto precisa. https://t.co/j9uh8RQxDO;295;3979
1049713946788331525;2018-10-09 17:31:22;RT @adrianasounovo: Posso agradecer mais uma vez?Obrigada, minha família, que se desdobrou comigo nesses meses. Meu marido, minhas filhas,…;25;0
1049713915691700227;2018-10-09 17:31:14;RT @hoc111: Apenas gratidão e muito trabalho pela frente! Obrigado a todos... https://t.co/oD8RApYQ1m;153;0
1049641828188860417;2018-10-09 12:44:47;O NOVO não perde tempo. @ViniciusPoit, nosso Deputado Federal eleito no domingo, já está lutando contra os privilégios dos políticos. A velha política está articulando para aumentar o salário de Deputados e Senadores em 16%.Se você é contra, assine: https://t.co/Ocaqi9P8om https://t.co/pdQdJGoM6o;2177;6718
1049629466060869634;2018-10-09 11:55:40;Com a força da onda laranja acabamos em 5º lugar na corrida presidencial, elegemos 8 deputados federais, 11 deputados estaduais, 1 deputada distrital e Romeu Zema está no segundo turno ao governo de Minas Gerais. O NOVO Brasil já começou!https://t.co/I06Vm54rUG;491;6307
1049439378475507712;2018-10-08 23:20:20;Em nossa campanha, mostramos que é possível fazer mais com menos. E o melhor: sem usar nem 1 centavo de dinheiro do seu imposto. https://t.co/luIFxoXu8n;1362;8641
1049433489341390849;2018-10-08 22:56:56;RT @marcelvanhattem: Muito obrigado! https://t.co/CFkMYnJwyx;334;0
1049432119192297473;2018-10-08 22:51:29;Em 2019 o NOVO terá uma bancada de 8 deputados federais.Gente séria, eleita sem usar dinheiro público,que passou por um processo seletivo, se comprometem a reduzir verbas e nº de assessores.Parabéns a todos!Obrigado aos milhões de brasileiros que fizeram a renovação acontecer! https://t.co/JtIjJSSlvs;598;5610
1049431042963243008;2018-10-08 22:47:12;RT @partidonovo30: Fizemos história! É a primeira vez que um partido estreante em eleições nacionais elege 20 deputados (somando federais,…;605;0
1049428563886264325;2018-10-08 22:37:21;RT @AlexisFonteyne: 44.728 votos! Vai começar a Renovação.Vou honrar sua confiança e apoio, vou te representar em Brasília!Alexis DEPUT…;193;0
1049428455681601537;2018-10-08 22:36:55;“Os deputados do NOVO vão cortar seus benefícios e começar a fazer um Estado diferente, que vá nos representar, menos intervencionista, com mais liberdade para as pessoas, possibilitando que cada um possa ter seu próprio negócio, trabalhar e pôr o Brasil na rota do crescimento.” https://t.co/zDptqllMVM;484;3753
1049363415867777024;2018-10-08 18:18:29;Parabéns aos 409 candidatos do NOVO. Cidadãos corajosos, que saíram de sua zona de conforto, passaram no processo seletivo e trabalharam duro durante a campanha.Todos vocês foram essenciais para o sucesso do NOVO nessas eleições e para a construção de um Brasil melhor.;496;7074
1049357704626655232;2018-10-08 17:55:47;8 dep. federais eleitos, 11 dep. estaduais, 1 dep. distrital e um governador no 2º turno.Sem dinheiro público,sem coligação,sem tempo de TV e sem participar de debates.Fiquei com 2,7 milhões votos graças a vocês que foram fiéis em todo o processo.Obrigado!https://t.co/XrV0Bw9FKS;1786;13923
1049347722334097408;2018-10-08 17:16:07;RT @Felippe_Hermes: Os eleitos pelo Novo https://t.co/IuRUH5nAWF;387;0
1049347573490827264;2018-10-08 17:15:32;RT @ViniciusPoit: Eu quero cumprimentar a todos os eleitos pelo NOVO pela batalha e pelo compromisso que agora temos como parlamentares! Ma…;156;0
1049313020416024578;2018-10-08 14:58:14;RT @goescarlos: 2,6 milhões de votos pra presidente, 8 deputados federais (suficiente pra participar da reunião de líderes que define a pau…;620;0
1049311057653768193;2018-10-08 14:50:26;RT @pauloganime3030: CONSEGUIMOS  ♡OBRIGADO POR ACREDITAR  EM NÓS. VAMOS REPRESENTAR  A VOZ DR VOCÊS ♡#PartidoNovo #eleições2018 #e…;365;0
1049307138345115648;2018-10-08 14:34:51;Feliz por ter mostrado que dá pra fazer política de forma diferente no Brasil.Estreante na política, desconhecido, sem recursos públicos e sem participar dos debates, terminamos entre os 5 candidatos mais votados.O NOVO está apenas começando.https://t.co/ScMKa8tjr9;2072;16374
1049260038899097600;2018-10-08 11:27:42;RT @OGloboPolitica: .@joaoamoedonovo supera rivais na eleição à Presidência e impulsiona o Novo https://t.co/01J0JobGWi https://t.co/AxGpOM…;650;0
1049259354686337024;2018-10-08 11:24:59;RT @ViniciusPoit: Ainda estou sem palavras! Mas só posso começar dizendo a você, que confiou seu voto em mim: MUITO OBRIGADO! Agora, quero…;304;0
1049146817466777600;2018-10-08 03:57:48;RT @leticiaarsenio: PARTIDO NOVO 2018:- João Amoêdo em quinto lugar na frente de Marina, Meirelles, Álvaro Dias e Cabo Daciolo - NOVO el…;1846;0
1049143640701001729;2018-10-08 03:45:10;RT @JovemPanNews: À frente de Marina e Meirelles, Amoêdo exalta força do Novo: ‘só 3 anos e esse desempenho?’. #EleicoesJP2018 https://t.…;391;0
1049143615660994561;2018-10-08 03:45:04;RT @Ricamconsult: Em sua 2ª eleição a Presidente, em 1994, Enéas teve 4,6 milhões de votos.Em 1989, na 1ª, s $ e tempo na TV, teve 360 mil.…;725;0
1049143343777767426;2018-10-08 03:43:59;RT @mvalenca3: A performance do NOVO foi muito significativa: 5º lugar do Amoedo1 candidato a Governador no 2º turno8 deputados federais…;2494;0
1049140601709649920;2018-10-08 03:33:06;RT @CanalDoOtario: Parabéns, @joaoamoedonovo e ao @partidonovo30, por iniciar esta mudança na forma de se fazer política e mostrar que aind…;614;0
1049136878786633728;2018-10-08 03:18:18;RT @TitooCamposs: mas agora vamos falar, na moral, que campanha o @joaoamoedonovo fez em? n teve um minuto na tv, n usou um centavo de dinh…;1992;0
1049136683101429762;2018-10-08 03:17:31;RT @partidonovo30: E nosso muito obrigado aos milhões de votos confiados a @joaoamoedonovo, o 5º candidato à Presidência mais votado do Bra…;1792;0
