id;created_at;text;retweet_count;favorite_count
1046232516888350721;2018-09-30 02:57:24;Pessoal, amanhã, dia 30/09, temos 2 caminhadas muito importantes da Onda Laranja.Conto com você para participar e divulgar para o maior número de pessoas possível! RJ: Às 10h, na Praia do Flamengo, em frente à Rua Paissandu.SP: Às 15h, na Avenida da Liberdade 365.;300;2007
1046232188033880064;2018-09-30 02:56:06;Atenção Onda Laranja: a nossa concentração deste domingo dia 30 será na Av da Liberdade às 15hs. Nos encontramos lá. Av. da Liberdade 365. https://t.co/Rs9IioiU32;123;762
1046231948027465728;2018-09-30 02:55:09;@reismpr @partidonovo30 Atenção Onda Laranja: a nossa concentração deste domingo dia 30 será na Av da Liberdade às 15hs. Nos encontramos lá. Av da Liberdade 365.;0;6
1046193809942564864;2018-09-30 00:23:36;Fui recepcionado no aeroporto por Rosana e sua mãe, Melânia, de 86 anos que panfleta de manhã e à tarde para o NOVO.É com pessoas como elas que a gente vai renovar a política e mudar o Brasil. #Vote30 https://t.co/rhvul3FOb7;184;1668
1046164656761507840;2018-09-29 22:27:45;RT @jesshubler: Acessibilidade no encontro do @partidonovo30. Discursos dos candidatos são reproduzidos por intérprete de Libras@correio_d…;92;0
1046154534316388353;2018-09-29 21:47:32;RT @mtrindadenovo: Vivemos uma crise geral e as nossas polícias estavam destroçadas no Rio de Janeiro. Com a intervenção, está sendo feito…;135;0
1046140400401092608;2018-09-29 20:51:22;RT @jesshubler: “A cada dia que passa fica mais claro que precisávamos fazer isso (fundar o NOVO). As pessoas passaram a ver com um pouco m…;47;0
1046140297116299264;2018-09-29 20:50:57;Essa é a prova de que o brasileiro quer um novo jeito de fazer política, com transparência e que não custe tanto aos bolsos do cidadão. A ausência nos debates não vai nos parar. Compartilhe nossos conteúdos e fale sobre o NOVO. Cada voto conta. Vote 30.https://t.co/6PCqRgUx4e;281;1283
1046134108970258432;2018-09-29 20:26:22;Útil é votar no candidato que você acredita, que representa a verdadeira renovação,que vai te representar quando estiver no Governo.Se todo mundo que acredita em um NOVO Brasil votar 30, nós chegaremos lá no dia 07/10.Vote sem medo. Vote 30. Vote Amoêdo.https://t.co/sFzgsBZBRt;817;3560
1046131637573038080;2018-09-29 20:16:33;Sensacional o evento hoje no Parcão, em Porto Alegre. Muito obrigado à onda laranja que tem feito um trabalho incrível para a construção de um Brasil melhor. https://t.co/pgXsKMUxm8;256;1918
1046105551543914497;2018-09-29 18:32:53;RT @jesshubler: Hino Nacional marca a chegada do candidato @joaoamoedonovo ao Parcão@correio_dopovo @agora_CP https://t.co/545Wt69R6P;174;0
1046105492412669952;2018-09-29 18:32:39;RT @jesshubler: “O voto serve para você dizer o que quer que seja feito, não é para votar em quem vai ganhar”, disse @joaoamoedonovo @corr…;177;0
1046103075281412097;2018-09-29 18:23:03;Fica claro nessa polarização: a disputa é apenas pelo pelo poder. Não existe a mínima intenção de fazer as mudanças necessárias ao Brasil.A gente só vai conseguir isso quando substituir de vez esses representantes da velha política.Dia 7, vote sem medo. Vote 30. Vote Amoêdo.;1647;8395
1046102733022011392;2018-09-29 18:21:41;No parcão agora em Porto Alegre! Essa é a força que vai mudar o Brasil. Dia 07, vote 30. Vote sem medo. Vote Amoêdo. https://t.co/oebqEvK7ui;117;741
1046077830948442112;2018-09-29 16:42:44;Voto útil é o voto pela renovação, é aquele que muda a sua vida.Vote sem medo. Vote 30. Vote João Amoêdo. https://t.co/8um5Y750El;394;1581
1046032588555669506;2018-09-29 13:42:58;São mensagens assim, como a do Fernando, que me fazem ter certeza de estarmos trilhando o caminho certo, com princípios e valores para construir um NOVO Brasil. Muito obrigado pelo apoio. https://t.co/7l87IniX38;241;1357
1046031421524062208;2018-09-29 13:38:19;Chegamos a 200 mil seguidores!Obrigado a todos que estão levando nossa mensagem de menos privilégios, mais liberdade, mais segurança e menos burocracia por todo Brasil.Conto com você nessa reta fina para mostrar a todos que o NOVO é a renovação que o Brasil tanto precisa.;214;1788
1046023796346540034;2018-09-29 13:08:01;“Atendendo ao pedido do NOVO, que recorreu contra a decisão de Lewandowski, Fux entendeu que a entrevista poderia afetar o processo eleitoral e que, nesse caso, a liberdade de imprensa não poderia se sobrepor ao direito dos eleitores.”No NOVO, discurso e prática andam juntos. https://t.co/Lbj1c2dCKw;915;4330
1046022969221353472;2018-09-29 13:04:44;Pessoal, não deixe de assistir e compartilhar a nossa entrevista com o @casseta! Muita gente ainda não me conhece e conto com você para divulgar nossas ideias e propostas para a construção de um NOVO Brasil: https://t.co/ZZdRJ1CoNu;324;998
1046022415304806401;2018-09-29 13:02:32;O NOVO informa que teve a sua conta no Twitter (@partidonovo30) bloqueada na madrugada deste sábado. Estamos em contato com o Twitter para a normalização da conta. Agradecemos as inúmeras mensagens de apoio e preocupação.;348;2431
1045837993876049920;2018-09-29 00:49:43;Auditório lotado agora à noite em Passo Fundo! Muito obrigado a todos que participaram e que estão trabalhando por um NOVO Brasil, com esperança e com renovação na política. Só assim vamos construir um Brasil melhor. https://t.co/jjI2u8ftAC;186;1360
1045837511921192962;2018-09-29 00:47:48;No NOVO, discurso e práticas andam juntos. Transformamos a nossa indignação em ação e recorremos ao STF contra a entrevista de Lula. É uma falta de respeito que um ex-presidente condenado e preso por corrupção possa fazer campanha de dentro do presídio.https://t.co/mFHTO8ZgBq;973;4101
1045810454092816384;2018-09-28 23:00:17;"Excelente artigo de um dos coordenadores do Plano de Governo @dgrcosta:""Precisamos de uma profunda renovação na Câmara, no Senado e no Planalto.Não se derrota o populismo imitando suas práticas,não se restaura a crença de um povo com reciclagem partidária""https://t.co/vncW21AVwR";220;948
1045778518402105345;2018-09-28 20:53:23;@rauenascimento Tudo seria mais fácil se usássemos fundo partidário e se tivéssemos apoio da política tradicional, mas para o NOVO as ideias vêm antes dos objetivos eleitorais. Vamos em frente! #EquipeJA;1;30
1045777611329286144;2018-09-28 20:49:46;@Gui_Girardi Obrigado pela recepção! Tem sido incrível o carinho que temos recebido em todos os cantos do Brasil! #EquipeJA;1;18
1045775515473383425;2018-09-28 20:41:27;@DeicideUH @D4NI3LS4L35 @partidonovo30 Voto útil acaba por eleger sempre os mesmos. Fazemos diferente: não entramos no jogo da velha política, mas apresentamos propostas para virar o jogo. #EquipeJA;10;38
1045775098572140544;2018-09-28 20:39:47;@LucasPoetero Obrigado pelo apoio! Vamos seguir em frente na reta final! Ajude divulgando para os amigos. #EquipeJA;5;49
1045774697374396416;2018-09-28 20:38:12;@fvpalha @antoniotabet @partidonovo30 Obrigado pela lembrança, Fernando! Tabet, se quiser conhecer nosso plano de governo, acesse: https://t.co/zsBXeF9r4U #EquipeJA;11;319
1045774049941557248;2018-09-28 20:35:37;@Bnof007 @jornaldarecord Temos um excelente argumento: 1 MILHÃO de pessoas assinaram uma petição para que fôssemos convidados.;6;14
1045773587435704320;2018-09-28 20:33:47;@lcamposmarinho Vamos seguir divulgando as ideias e buscando um país mais livre! #EquipeJA;8;77
1045769172272205826;2018-09-28 20:16:14;Pessoal, muito obrigado! Chegamos a 1 milhão de assinaturas.Mesmo assim, ainda não podemos participar dos debates por causa do sistema que dificulta a tão necessária renovação política.Isso só mostra a importância de renovarmos tudo, votando 30, dia 07/10! https://t.co/e1RXiE8XkM;1403;8337
1045762629875257346;2018-09-28 19:50:14;@biiancaaDantas 05/10! Em breve divulgaremos maiores informações. #EquipeJA;1;5
1045762427051274240;2018-09-28 19:49:26;@thaa_naoane Curitiba dia 02/10. Assim que tivermos a confirmação do local informaremos! #EquipeJA;2;7
1045734589862490112;2018-09-28 17:58:49;Casa cheia no evento que fizemos hoje à tarde em Novo Hamburgo. Partindo agora para Passo Fundo, onde faço uma apresentação às 19h, no CTG Lalau Miranda.Amanhã, 29/09, estarei no Parcão, em Porto Alegre, a partir das 14h, com Bernardinho e os candidatos do NOVO.Espero você! https://t.co/d7NG8RP7bq;122;786
1045721468276035584;2018-09-28 17:06:41;RT @ChicaoBulhoes: Se assim como eu você também está cansado da velha política, conheça os candidatos do @partidonovo30 #chicao30123 #Vamos…;95;0
1045721430040739840;2018-09-28 17:06:32;991 mil assinaturas já! Compartilhe e para chegarmos a 1 milhão ainda hoje!https://t.co/SYdkRXWAgo https://t.co/hlDLIPHst8;382;1171
1045709622789754881;2018-09-28 16:19:37;"""O voto autêntico é a decisão mais racional a tomar e a melhor forma de imprimir novos valores à política.""";118;608
1045709621275611138;2018-09-28 16:19:36;"""Quem está descontente com o provável resultado da eleição promove o voto útil como saída, mas pode ser vítima da própria tática.A opção pelo voto autêntico deve ser propagada e defendida por aqueles que por ele se decidirem, de forma a influenciarem outros eleitores.""";127;589
1045709619014914049;2018-09-28 16:19:36;"""O voto útil é defensivo, dado a alguém que não era inicialmente a opção preferida. Ou seja, escolhe-se o nome com mais chances de vencer, e não o que tem as propostas mais alinhadas com a sua preferência. Isso enfraquece o debate sobre as agendas de governo.""";62;191
1045709617349750784;2018-09-28 16:19:35;"Excelente artigo sobre o voto útil:""Quando a sociedade deixa em 2º plano a reflexão sobre qual é o candidato que melhor a representa, acaba por reforçar a classe política tradicional e a manutenção do status quo.""https://t.co/bdP7lUPeF4";221;795
1045706880826380289;2018-09-28 16:08:43;Qual partido defende:➡️ Aprofundar a Lava-Jato➡️ Eliminar mordomias para políticos➡️ Reduzir o número de assessores➡️ Eliminar o Fundo Partidário e o Fundo Eleitoral➡️ Devolver poder ao cidadãoEu só conheço o @partidonovo30;1570;6165
1045696107483992064;2018-09-28 15:25:54;Pessoal, em 3h conseguimos mais de 20 mil assinaturas e já estamos agora com 982 mil! Vamos divulgar ainda mais para chegarmos a 1 milhão de assinaturas ainda hoje! #JoaoCom6 https://t.co/NxfFy1HmXx;392;1242
1045695553512902656;2018-09-28 15:23:42;RT @ChristianProf_: O Brasil que eu quero é um Brasil sem polarização, ainda mais essa que tá aí se desenhando... O Brasil que eu quero é c…;273;0
1045695499825819648;2018-09-28 15:23:29;RT @DeniseCToledo8: Hoje às 14 horas Gustavo Franco, do @joaoamoedonovo  fecha a série. Acompanhe no facebook @JovemPanNews  youtube e 620…;44;0
1045692343804940290;2018-09-28 15:10:57;A principal estratégia utilizada pelo PT, para se viabilizar e crescer foi a divisão da sociedade, o nós contra eles. Todos aqueles que  transformam a eleição em um plebiscito no primeiro turno estão, ao contrário do que imaginam, fortalecendo o PT.;603;2836
1045668820021587968;2018-09-28 13:37:28;Um absurdo o sistema dar espaço para um presidiário que causou tanto mal ao nosso país.Essa eleição não é apenas contra o PT, é contra todo o sistema que se instaurou no Brasil e a favor da renovação. https://t.co/9RryKiBgvE;3851;14199
1045667170842275840;2018-09-28 13:30:55;@LaiVladimir Obrigado pela confiança, Vladimir. Vamos que vamos. O povo quer o NOVO e só o João é novo. #VemComJoão30 #EquipeJA;0;3
1045666311471353858;2018-09-28 13:27:30;@sheila_tacon Vamos que vamos, Sheila. A onda laranja vai avançar ainda mais. #JoãoCom6% #EquipeJA;1;5
1045666193057763330;2018-09-28 13:27:02;@marialroes Obrigado pelo carinho, Maria. Vamos que vamos. Um NOVO Brasil vem aí e ele depende de cada um de nós. #VemComJoão30 #EquipeJA;0;4
1045665728047849472;2018-09-28 13:25:11;@Valeria78362921 Obrigado pelo carinho, Valeria. A onda laranja está crescendo e nós vamos contar com você para avançar ainda mais. #VamosRenovarTudo #EquipeJA;0;3
1045665494387380224;2018-09-28 13:24:16;@NgelaFonseca Obrigado, Ângela. Vamos que vamos. Se cada um fizer a sua parte nós vamos chegar lá! #JoãoCom6% #EquipeJA;0;2
1045665232205606914;2018-09-28 13:23:13;@brendaocampos Obrigado por estar com a gente, Brenda. Vamos avançar ainda mais. #VemComJoão30 #EquipeJA;0;3
1045665006925352960;2018-09-28 13:22:19;@silvanaharse Vamos que vamos, Silvana. O NOVO Brasil que vem aí depende de cada um de nós. #VemComJoão30 #EquipeJA;1;8
1045664822703124480;2018-09-28 13:21:35;@Beatriz12811538 Obrigado por estar com a gente, Garcia. Vamos avançar ainda mais. Um NOVO Brasil vem aí. #JoãoCom6% #EquipeJA;0;7
1045641307002163201;2018-09-28 11:48:09;Já estamos com 960 mil assinaturas para que eu participe dos debates.Nossa meta: bater 1 milhão hoje.Compartilhe ao máximo, peça para que seus amigos assinem. Só assim vamos ter novas ideias e propostas nos debates.Retuíte para chegar a mais pessoas! https://t.co/SYdkRXWAgo;1310;2701
1045629904807755776;2018-09-28 11:02:50;Evento sensacional ontem com os candidatos do NOVO:@rogerchequer 30 para governador@DiogodaLuz300 300 para o senado@joaoamoedonovo e @ChristianProf_ 30 para presidenteEscolha seu candidato a deputado federal e estadual no site do NOVO: https://t.co/7jcOtMbAAtE divulgue! https://t.co/qS7Ot3w1fC;113;691
1045488415796547585;2018-09-28 01:40:37;RT @exame: Quase 1 milhão assinam petição por Amoêdo nos debates eleitorais https://t.co/mFSeBx1LAl;741;0
1045484064894005249;2018-09-28 01:23:19;Quando estávamos saindo do Capão Redondo, esses jovens nos abordaram para tirar foto e declarar que iriam votar em mim e em todos os candidatos do NOVO. #Joãocom6 https://t.co/IH3SfpTNCn;174;1408
1045467232573247489;2018-09-28 00:16:26;RT @partidonovo30: Nossa petição pedindo @joaoamoedonovo nos debates está próxima de 1 milhão de assinaturas. Assine e divulgue pelo link h…;508;0
1045459830117421056;2018-09-27 23:47:01;Depoimento de um apoiador hoje na chegada do evento na Fecomercio: “você e o NOVO me fizeram voltar a ter esperança na política”. São mensagens como essa que nos indicam que estamos no caminho certo. https://t.co/uK0SLYpONW;198;1111
1045459325874040833;2018-09-27 23:45:01;Casa cheia na Fecomercio para divulgar as ideias do NOVO e mostrar que existe sim esperança na política. #joaocom6 https://t.co/ANqEmf9JFz;124;644
1045448943914676225;2018-09-27 23:03:46;Muito legal o evento hoje no Capão Redondo. Foi uma ótima oportunidade para conversarmos sobre empreendedorismo, sobre como o estado atrapalha justamente quem mais precisa e sobre a nossa participação política. https://t.co/n4bbH0ksgJ;121;783
1045437516684431360;2018-09-27 22:18:21;.@RomeuZema30, candidato do NOVO ao governo de Minas, com 8% na pesquisa do Ibope divulgada hoje.  Terceiro lugar! 👏👏;405;2961
1045431028100272128;2018-09-27 21:52:34;RT @CanalDoOtario: Este é o mapa de todas as coligações para presidente e ligações entre os partidos nas disputas pelos governos dos estado…;863;0
1045430931459383301;2018-09-27 21:52:11;RT @ChristianProf_: Fábrica de Criatividade participando do debate sobre o NOVO Brasil. Aqui existem indivíduos criando oportunidades para…;113;0
1045409602504982530;2018-09-27 20:27:26;@NetoAguirre3 Vamos trilhar esse caminho juntos, Neto. Contamos com o seu apoio. #VemComJoão30 #VamosRenovarTudo #EquipeJA;1;4
1045387716232466432;2018-09-27 19:00:28;@nilton_gonzaga Conheça o @mtrindadenovo, ele é excelente!!! #equipeJA;1;13
1045386882383794177;2018-09-27 18:57:09;Iniciando agora conversa no Capão Redondo, na Fábrica de Criatividade. Obrigado a todos que estão participando e conversando sobre o NOVO Brasil que queremos. https://t.co/k95c5TIyVl;72;567
1045386212196995073;2018-09-27 18:54:29;Conversa muito legal agora no Jardim São Luís com empreendedores locais. São essas pessoas que vão fazer as mudanças que o Brasil tanto precisa. https://t.co/e7mGfAAFgG;97;784
1045372430691323904;2018-09-27 17:59:44;@barbaravolks Vamos que vamos, Bárbara. Contamos com você. #VemComJoão30 #EquipeJA;3;4
1045372245516922880;2018-09-27 17:59:00;@paks_ Obrigado por trilhar esse caminho com a gente, Vitor. Um NOVO Brasil vem aí e ele depende de cada um de nós, vamos em frente. #VemComJoão30 #EquipeJA;2;4
1045371216587091968;2018-09-27 17:54:54;@MarceloKlafke Vamos trilhar esse caminho juntos, Marcelo. Obrigado por estar com a gente. Vamos em frente. #VemComJoão30 #EquipeJA;2;11
1045369283675451392;2018-09-27 17:47:13;@joaoengaliment1 Obrigado pelo carinho, João. Vamos contar com você para a onda laranja avançar ainda mais, vamos que vamos. #VemComJoão30 #EquipeJA;2;3
1045368515283353602;2018-09-27 17:44:10;@valeria82494024 Obrigado pelo carinho, Valeria. Vamos que vamos, a onda laranja vai avançar ainda mais. #VemComJoão30 #EquipeJA;1;2
1045365931051032577;2018-09-27 17:33:54;@valeria82494024 Vamos que vamos, Valeria. Um NOVO Brasil vem aí. #VemComJoão30 #EquipeJA;1;11
1045365405437452289;2018-09-27 17:31:49;@nara_gontijo Isso mesmo, Nara. Vamos nos unir, juntos somos fortes. A onda laranja vai avançar ainda mais. Vamos que vamos. Um NOVO Brasil vem aí. #VemComJoão30 #EquipeJA;2;12
1045364472427081729;2018-09-27 17:28:06;@stellamarisk Vamos que vamos, Stella. A onda laranja vai avançar ainda mais. Contamos com o seu apoio nessa jornada. #VamosRenovarTudo #EquipeJA;1;1
1045364193984155648;2018-09-27 17:27:00;@AugCalado Vamos que vamos, Augusto. Precisamos acreditar em nosso voto e votar em quem realmente nós representa. #VemComJoão30 #EquipeJA;1;6
1045363112210128897;2018-09-27 17:22:42;@Nanda_CSilva Continue nos acompanhando, Nanda. Vamos avançar ainda mais. O povo quer o NOVO e só o NOVO é novo. #VamosRenovarTudo #EquipeJA;1;3
1045362116759355397;2018-09-27 17:18:45;@MarceloKlafke Vamos que vamos, Marcelo. A onda laranja está crescendo e vamos avançar ainda mais. #VamosRenovarTudo #EquipeJA;6;8
1045361752538587136;2018-09-27 17:17:18;@tiago71297585 Nós vamos chegar lá, Tiago. Um NOVO Brasil vem aí. #VemComJoão30 #EquipeJA;1;2
1045361417753415681;2018-09-27 17:15:58;@Paula42311024 #VamosRenovarTudo #VemComJoão30 #JoãoCom6%#EquipeJA;1;2
1045361307145457668;2018-09-27 17:15:32;@brennodmoura Obrigado pelo carinho, Brenno. Vamos avançar ainda mais, contamos com você. #VemComJoão30 #EquipeJA;1;1
1045355580221771776;2018-09-27 16:52:46;RT @vieirabruno: Pela primeira vez na minha vida vou votar pra Presidente com a convicção de estar apoiando uma agenda de país certeira par…;284;0
1045355539088183296;2018-09-27 16:52:36;RT @Felippe_Hermes: Bacana o @RomeuZema30 ter sido confirmado no debate da Globo pra governadores de Minas.A campanha dele é algo muito ú…;244;0
1045353332972421121;2018-09-27 16:43:50;Continuamos em 5º lugar no Trending Topics do Twitter, com mais de 61 mil tweets sobre o assunto. Vamos divulgar bastante para chegar aos 6% na pesquisa de amanhã e poder participar do debate da Globo. #JoaoCom6;394;1300
1045352742796099585;2018-09-27 16:41:30;São pessoas como a Cristiana que vão mudar o Brasil. https://t.co/bVE2danYce;162;967
1045351019960512513;2018-09-27 16:34:39;Marcelo Madureira também vota 30 por um NOVO Brasil.Pesquise os candidatos do NOVO no seu estado e escolha o que melhor te representa. Todos se comprometem a cortar mordomias e a devolver poder para o cidadão. Dia 07/10, vote sem medo. Vote 30. Vote João Amoêdo. #JoaoCom6 https://t.co/CSmXfhuhgc;779;3419
1045331585308987392;2018-09-27 15:17:25;Faltam 10 dias p/ escolha de quem vai governar o país pelos próximos 4 anos. A @gazetadopovo resgatou pontos do meu programa de governo e dos meus posicionamentos p/ projetar um futuro governo Amoêdo.Dia 7/10,vote sem medo. Vote 30. Vote Amoêdo. #JoãoCom6https://t.co/GDtQoxmqt3;509;1524
1045329173923926016;2018-09-27 15:07:50;Para o Brasil voltar a gerar empregos e crescer precisamos reduzir e simplificar impostos.Trabalhamos 153 dias por ano p/ pagar impostos e isso asfixia a economia.Defendo a simplificação e união do PIS/Cofins,ISS,IPI e ICMS em um único tributo. #JoãoCom6https://t.co/hoo8dIF19t;457;1305
1045326425765695489;2018-09-27 14:56:55;Já são mais de 43 mil tweets sobre #JoaoCom6% vamos continuar divulgando nossas ideias e usando a hashtag para chegarmos ao 1º lugar.;1001;2893
1045323158058913792;2018-09-27 14:43:56;#JoaoCom6% em 5º lugar no Trending Topics. Vamos tuitar mais ainda para chegar ao 1º lugar!A mudança que a gente quer não virá dos políticos que a gente tem. Vamos aproveitar esses 10 dias para divulgar ao máximo os candidatos do NOVO.;1508;3865
1045318132133441537;2018-09-27 14:23:58;RT @aconfusedgirl: @RedeGlobo @joaoamoedonovo #joaocom6% pelo fim do dinheiro público em campanhas;266;0
1045318102077116416;2018-09-27 14:23:51;RT @DiogodaLuz300: Vamos votar sem medo! Voto consciente é no João Amôedo Presidente!#JoaoCom6%@joaoamoedonovo https://t.co/dF6dTqQ8iW;633;0
1045314941887172613;2018-09-27 14:11:17;#JoaoCom6% https://t.co/ZM3qMCSZ28;309;805
1045313265298010115;2018-09-27 14:04:38;Se você quer ver novas ideias, novas práticas e novas lideranças nos debates, ajude a divulgar nossas propostas. Ainda faltam 10 dias para as eleições e temos tempo para virar esse jogo. Só depende de nós. #JoaoCom6%;742;1792
1045312428496605186;2018-09-27 14:01:18;Pessoal, entre hoje e amanhã mais de 8 mil brasileiros serão entrevistados pelo Datafolha. Se chegarmos aos 6%, participaremos do debate da Globo dia 04.Vamos começar agora o tuitaço #JoaoCom6%.Divulgue a todos os seus conhecidos para podermos virar esse jogo!;2363;5872
1045306648921870337;2018-09-27 13:38:20;@UmaUniUnicornio Vamos em frente, Ana Elisa. Juntos nós podemos fazer a onda laranja avançar. Não esqueça de assinar e compartilhar a nossa petição: https://t.co/SyPddv9GHc. #JoãoCom6% #EquipeJA;2;5
1045302677331161088;2018-09-27 13:22:33;RT @rrachewsky: No primeiro turno, vote 30.No segundo turno, repita.;731;0
1045300451967750144;2018-09-27 13:13:43;@DanielXReis @MarceloKlafke Contamos com o apoio de vocês para fazer a onda laranja avançar ainda mais. Vamos que vamos! E não deixem de assinar e compartilhar a nossa petição: https://t.co/SyPddv9GHc. #JoãoCom6% #EquipeJA;4;21
1045278201419894785;2018-09-27 11:45:18;Logo mais, às 11h, vamos fazer um tuitaço com a #JoaoCom6%!As pesquisas do DataFolha serão feitas hoje e amanhã e temos que divulgar nossas ideias para o maior nº de pessoas para que elas indiquem intenção de voto em mim. Se chegarmos aos 6%, participaremos do debate da Globo!;777;2233
1045276636780924928;2018-09-27 11:39:05;Pessoal, hoje, às 14h farei uma caminhada pelo Capão Redondo com a nossa vereadora em SP, @janainalimasp. Às 19h30 faremos um grande evento na Fecomercio, com Rogério Chequer, Andrea Menezes, Diogo da Luz, Bernardinho e os candidatos ao legislativo pelo NOVO.Espero vocês!;108;577
1045276091491979265;2018-09-27 11:36:55;O Brasil (ou seja, nós, pagadores de impostos) gasta R$ 29 milhões por dia para sustentar o Congresso. Dinheiro que deveria estar indo para segurança, da saúde e da educação. Defendemos a redução de 1/3 Congresso e o fim de privilégios e mordomias.#JoaoCom6%;1199;3921
1045273369065779200;2018-09-27 11:26:06;RT @partidonovo30: Em meio a tantas notícias ruins, vemos que se começa a fazer  justiça ao povo venezuelano. https://t.co/kqyh3ajr1C;349;0
1045139585678880769;2018-09-27 02:34:29;Cláudio Manoel tem um recado sobre o voto útil, o voto em quem você acredita.Essa eleição você tem a chance de votar em uma nova forma de fazer política, sem privilégios, colocando o cidadão em 1º lugar, trazendo esperança.Vote sem medo. Vote 30. Vote João Amoêdo. #JoaoCom6% https://t.co/xv94zsrf2V;805;2779
1045136711087542274;2018-09-27 02:23:04;RT @felipecamozzato: Vitória!!! Prefeitura retira urgência do projeto do IPTU e, com isso, está enterrada a possibilidade de qualquer aumen…;154;0
1045109072540966912;2018-09-27 00:33:14;Amanhã e sexta serão realizadas as entrevistas do Datafolha.Vamos divulgar ao máximo nossas propostas p/ chegarmos aos 6% e participarmos do debate da Globo. Conto com vocês para declarar a intenção de voto em mim e pedir que todos façam o mesmo.Tuitaço amanhã às 11h #JoaoCom6%;1080;3986
1045100163008802817;2018-09-26 23:57:50;Recebi agora essa foto de uma apresentação que alunos de Ananindeua-PA fizeram hoje. Muito legal! É a onda laranja se espalhando por todo o Brasil. #JoaoCom6% https://t.co/Lq0gegZTZb;181;1183
1045092745923235840;2018-09-26 23:28:22;RT @folha: Amoêdo faz 'tuitaço' para chegar a 6% e enche caixa de emails do Datafolha https://t.co/A0G3j8B6Db;447;0
1045092714549776384;2018-09-26 23:28:14;RT @reismpr: Nem vj Debate algum ! Que Democracia é essa onde temos pela  1 vez uma Proposta REALMENTE Nova mas infelizmente os meios de co…;236;0
1045088289319981056;2018-09-26 23:10:39;Pessoal, estamos ao vivo agora. Acompanhe: https://t.co/yMp1Z2mvv8#JoãoCom6% #ChequerCom6;119;526
1045078863884296193;2018-09-26 22:33:12;Pessoal, acompanhe, às 20h, ao vivo, minha conversa com o @rogerchequer, candidato ao governo por SP. Vamos divulgar nossas ideias por um NOVO Brasil e SP. #JoaoCom6%;171;900
1045054912860745728;2018-09-26 20:58:02;Pessoal, olha a força da nossa onda laranja! O movimento #JoãoCom6% encheu a caixa de e-mails do Datafolha com mais de mil pedidos de militantes que querem participar das pesquisas do instituto.Vamos continuar trabalhando para estar no debate dia 04/10!https://t.co/fC9p90KvBP;1316;5279
1045047173426155520;2018-09-26 20:27:16;@IsaacGuerra @ChristianProf_ Nós também, @IsaacGuerra. Ajude divulgando as ideias! #EquipeJA;2;6
